Id	Tense	Sentence
401	Simple Past Tense	after this spring it rained.
402	Past Continuous Tense	recently it was raining.
403	Past Perfect Tense	after 7 am it had rained.
404	Past Perfect Continuous Tense	after last morning it had been raining.
405	Simple Future Tense	next breakfast it will rain.
406	Future Continuous Tense	next summer it will be raining.
407	Future Perfect Tense	next night it will have rained.
408	Future Perfect Continuous Tense	by tomorrow it will have been raining.
409	Simple Present Tense	this day she loves.
410	Present Continuous Tense	at the moment she is loving.
411	Present Perfect Tense	this day she has loved.
412	Present Perfect Continuous Tense	today she has been loving.
413	Simple Past Tense	last tuesday she loved.
414	Past Continuous Tense	since wednesday she was loving.
415	Past Perfect Tense	last week she had loved.
416	Past Perfect Continuous Tense	since last summer she had been loving.
417	Simple Future Tense	later she will love.
418	Future Continuous Tense	after this winter she will be loving.
419	Future Perfect Tense	tomorrow at 1 pm she will have loved.
420	Future Perfect Continuous Tense	before the end of summer, she will have been loving.
421	Simple Present Tense	today she repeats it.
422	Present Continuous Tense	today she is repeating it.
423	Present Perfect Tense	this day she has repeated it.
424	Present Perfect Continuous Tense	this day she has been repeating it.
425	Simple Past Tense	after 1 pm she repeated it.
426	Past Continuous Tense	since 1 pm she was repeating it.
427	Past Perfect Tense	after last night she had repeated it.
428	Past Perfect Continuous Tense	after 7 am she had been repeating it.
429	Simple Future Tense	next summer she will repeat it.
430	Future Continuous Tense	after this evening she will be repeating it.
431	Future Perfect Tense	then she will have repeated it.
432	Future Perfect Continuous Tense	by the end of this year, she will have been repeating it.
433	Simple Present Tense	this day she asks for help.
434	Present Continuous Tense	at the moment she is asking for help.
435	Present Perfect Tense	today she has asked for help.
436	Present Perfect Continuous Tense	this day she has been asking for help.
437	Simple Past Tense	last spring she asked for help.
438	Past Continuous Tense	last friday she was asking for help.
439	Past Perfect Tense	last friday she had asked for help.
440	Past Perfect Continuous Tense	since 12 o'clock she had been asking for help.
441	Simple Future Tense	next winter she will ask for help.
442	Future Continuous Tense	next spring she will be asking for help.
443	Future Perfect Tense	next night she will have asked for help.
444	Future Perfect Continuous Tense	by next week she will have been asking for help.
445	Simple Present Tense	this day he thinks about it.
446	Present Continuous Tense	this day he is thinking about it.
447	Present Perfect Tense	this day he has thought about it.
448	Present Perfect Continuous Tense	this day he has been thinking about it.
449	Simple Past Tense	last thursday he thought about it.
450	Past Continuous Tense	after last autumn he was thinking about it.
451	Past Perfect Tense	before this day he had thought about it.
452	Past Perfect Continuous Tense	since tuesday he had been thinking about it.
453	Simple Future Tense	after this autumn he will think about it.
454	Future Continuous Tense	after this winter he will be thinking about it.
455	Future Perfect Tense	next dinner he will have thought about it.
456	Future Perfect Continuous Tense	by next week he will have been thinking about it.
457	Simple Present Tense	this day she learns about it.
458	Present Continuous Tense	this day she is learning about it.
459	Present Perfect Tense	this day she has learned about it.
460	Present Perfect Continuous Tense	today she has been learning about it.
461	Simple Past Tense	before thursday she learned about it.
462	Past Continuous Tense	since tuesday she was learning about it.
463	Past Perfect Tense	before 9 am she had learned about it.
464	Past Perfect Continuous Tense	after this week she had been learning about it.
465	Simple Future Tense	after this day she will learn about it.
466	Future Continuous Tense	soon she will be learning about it.
467	Future Perfect Tense	after this year she will have learned about it.
468	Future Perfect Continuous Tense	before the end of summer, she will have been learning about it.
469	Simple Present Tense	today he talks about it.
470	Present Continuous Tense	at the moment he is talking about it.
471	Present Perfect Tense	today he has talked about it.
472	Present Perfect Continuous Tense	today he has been talking about it.
473	Simple Past Tense	recently he talked about it.
474	Past Continuous Tense	last friday he was talking about it.
475	Past Perfect Tense	after this morning he had talked about it.
476	Past Perfect Continuous Tense	before sunday he had been talking about it.
477	Simple Future Tense	after this week he will talk about it.
478	Future Continuous Tense	next year he will be talking about it.
479	Future Perfect Tense	the next day he will have talked about it.
480	Future Perfect Continuous Tense	by the end of this year, he will have been talking about it.
481	Simple Present Tense	today she hears the music.
482	Present Continuous Tense	this day she is hearing the music.
483	Present Perfect Tense	this day she has heard the music.
484	Present Perfect Continuous Tense	this day she has been hearing the music.
485	Simple Past Tense	before last year she heard the music.
486	Past Continuous Tense	last winter she was hearing the music.
487	Past Perfect Tense	before sunday she had heard the music.
488	Past Perfect Continuous Tense	last sunday she had been hearing the music.
489	Simple Future Tense	next evening she will hear the music.
490	Future Continuous Tense	later she will be hearing the music.
491	Future Perfect Tense	tomorrow night she will have heard the music.
492	Future Perfect Continuous Tense	by tomorrow she will have been hearing the music.
493	Simple Present Tense	today she wants to go.
494	Present Continuous Tense	today she is wanting to go.
495	Present Perfect Tense	this day she has wanted to go.
496	Present Perfect Continuous Tense	today she has been wanting to go.
497	Simple Past Tense	earlier this night she wanted to go.
498	Past Continuous Tense	before monday she was wanting to go.
499	Past Perfect Tense	after 1 pm she had wanted to go.
500	Past Perfect Continuous Tense	since monday she had been wanting to go.
501	Simple Future Tense	next dinner she will want to go.
502	Future Continuous Tense	after this autumn she will be wanting to go.
503	Future Perfect Tense	tomorrow night she will have wanted to go.
504	Future Perfect Continuous Tense	by tomorrow she will have been wanting to go.
505	Simple Present Tense	this day she speaks to him.
506	Present Continuous Tense	this day she is speaking to him.
507	Present Perfect Tense	today she has spoken to him.
508	Present Perfect Continuous Tense	this day she has been speaking to him.
509	Simple Past Tense	after last autumn she spoke to him.
510	Past Continuous Tense	since this weekend she was speaking to him.
511	Past Perfect Tense	before this year she had spoken to him.
512	Past Perfect Continuous Tense	since saturday she had been speaking to him.
513	Simple Future Tense	later this night she will speak to him.
514	Future Continuous Tense	next breakfast she will be speaking to him.
515	Future Perfect Tense	next morning she will have spoken to him.
516	Future Perfect Continuous Tense	by the end of this year, she will have been speaking to him.
517	Simple Present Tense	this day she comes to the party.
518	Present Continuous Tense	this day she is coming to the party.
519	Present Perfect Tense	today she has come to the party.
520	Present Perfect Continuous Tense	today she has been coming to the party.
521	Simple Past Tense	last year she came to the party.
522	Past Continuous Tense	since 1 pm she was coming to the party.
523	Past Perfect Tense	after breakfast she had come to the party.
524	Past Perfect Continuous Tense	before last year she had been coming to the party.
525	Simple Future Tense	next lunch she will come to the party.
526	Future Continuous Tense	tomorrrow evening she will be coming to the party.
527	Future Perfect Tense	after this day she will have come to the party.
528	Future Perfect Continuous Tense	by the end of this year, she will have been coming to the party.
529	Simple Present Tense	today she drives a car.
530	Present Continuous Tense	at the moment she is driving a car.
531	Present Perfect Tense	today she has driven a car.
532	Present Perfect Continuous Tense	this day she has been driving a car.
533	Simple Past Tense	after this weekend she drove a car.
534	Past Continuous Tense	last friday she was driving a car.
535	Past Perfect Tense	after this spring she had driven a car.
536	Past Perfect Continuous Tense	since 9 am she had been driving a car.
537	Simple Future Tense	after lunch she will drive a car.
538	Future Continuous Tense	later today she will be driving a car.
539	Future Perfect Tense	next night she will have driven a car.
540	Future Perfect Continuous Tense	in a few weeks she will have been driving a car.
541	Simple Present Tense	today he flies a plane.
542	Present Continuous Tense	at the moment he is flying a plane.
543	Present Perfect Tense	today he has flown a plane.
544	Present Perfect Continuous Tense	today he has been flying a plane.
545	Simple Past Tense	yesterday at dinner he flew a plane.
546	Past Continuous Tense	since last autumn he was flying a plane.
547	Past Perfect Tense	after last winter he had flown a plane.
548	Past Perfect Continuous Tense	last thursday he had been flying a plane.
549	Simple Future Tense	next dinner he will fly a plane.
550	Future Continuous Tense	tomorrow at 12 o'clock he will be flying a plane.
551	Future Perfect Tense	later he will have flown a plane.
552	Future Perfect Continuous Tense	by the end of this year, he will have been flying a plane.
553	Simple Present Tense	this day she gives a lecture.
554	Present Continuous Tense	today she is giving a lecture.
555	Present Perfect Tense	this day she has given a lecture.
556	Present Perfect Continuous Tense	this day she has been giving a lecture.
557	Simple Past Tense	before tuesday she gave a lecture.
558	Past Continuous Tense	since wednesday she was giving a lecture.
559	Past Perfect Tense	earlier this night she had given a lecture.
560	Past Perfect Continuous Tense	yesterday at lunch she had been giving a lecture.
561	Simple Future Tense	after this day she will give a lecture.
562	Future Continuous Tense	next autumn she will be giving a lecture.
563	Future Perfect Tense	after this winter she will have given a lecture.
564	Future Perfect Continuous Tense	by tomorrow she will have been giving a lecture.
565	Simple Present Tense	this day he sleeps.
566	Present Continuous Tense	now he is sleeping.
567	Present Perfect Tense	this day he has slept.
568	Present Perfect Continuous Tense	this day he has been sleeping.
569	Simple Past Tense	earlier this day he slept.
570	Past Continuous Tense	since this weekend he was sleeping.
571	Past Perfect Tense	after 9 o'clock he had slept.
572	Past Perfect Continuous Tense	last thursday he had been sleeping.
573	Simple Future Tense	after this evening he will sleep.
574	Future Continuous Tense	later he will be sleeping.
575	Future Perfect Tense	after dinner he will have slept.
576	Future Perfect Continuous Tense	by tomorrow he will have been sleeping.
577	Simple Present Tense	this day he calls her.
578	Present Continuous Tense	today he is calling her.
579	Present Perfect Tense	this day he has called her.
580	Present Perfect Continuous Tense	this day he has been calling her.
581	Simple Past Tense	lately he called her.
582	Past Continuous Tense	last summer he was calling her.
583	Past Perfect Tense	last week he had called her.
584	Past Perfect Continuous Tense	previously he had been calling her.
585	Simple Future Tense	tomorrow at 12 o'clock he will call her.
586	Future Continuous Tense	next night he will be calling her.
587	Future Perfect Tense	tomorrow night he will have called her.
588	Future Perfect Continuous Tense	by tomorrow he will have been calling her.
589	Simple Present Tense	today she leaves him.
590	Present Continuous Tense	at the moment she is leaving him.
591	Present Perfect Tense	this day she has left him.
592	Present Perfect Continuous Tense	this day she has been leaving him.
593	Simple Past Tense	last tuesday she left him.
594	Past Continuous Tense	after this night she was leaving him.
595	Past Perfect Tense	recently she had left him.
596	Past Perfect Continuous Tense	after lunch she had been leaving him.
597	Simple Future Tense	tomorrow at 1 pm she will leave him.
598	Future Continuous Tense	next breakfast she will be leaving him.
599	Future Perfect Tense	after this night she will have left him.
600	Future Perfect Continuous Tense	in a few weeks she will have been leaving him.
601	Simple Present Tense	today he makes her happy.
602	Present Continuous Tense	today he is making her happy.
603	Present Perfect Tense	this day he has made her happy.
604	Present Perfect Continuous Tense	today he has been making her happy.
605	Simple Past Tense	after this weekend he made her happy.
606	Past Continuous Tense	since 1 pm he was making her happy.
607	Past Perfect Tense	after this morning he had made her happy.
608	Past Perfect Continuous Tense	since this week he had been making her happy.
609	Simple Future Tense	after dinner he will make her happy.
610	Future Continuous Tense	after this winter he will be making her happy.
611	Future Perfect Tense	tomorrow at 12 o'clock he will have made her happy.
612	Future Perfect Continuous Tense	in a few weeks he will have been making her happy.
613	Simple Present Tense	this day she tells him.
614	Present Continuous Tense	at the moment she is telling him.
615	Present Perfect Tense	this day she has told him.
616	Present Perfect Continuous Tense	today she has been telling him.
617	Simple Past Tense	before last day she told him.
618	Past Continuous Tense	after this autumn she was telling him.
619	Past Perfect Tense	before wednesday she had told him.
620	Past Perfect Continuous Tense	after last week she had been telling him.
621	Simple Future Tense	next spring she will tell him.
622	Future Continuous Tense	next spring she will be telling him.
623	Future Perfect Tense	tomorrow night she will have told him.
624	Future Perfect Continuous Tense	in a few weeks she will have been telling him.
625	Simple Present Tense	today he lets her go.
626	Present Continuous Tense	at the moment he is letting her go.
627	Present Perfect Tense	today he has let her go.
628	Present Perfect Continuous Tense	today he has been letting her go.
629	Simple Past Tense	after last summer he let her go.
630	Past Continuous Tense	earlier this night he was letting her go.
631	Past Perfect Tense	last spring he had let her go.
632	Past Perfect Continuous Tense	yesterday at dinner he had been letting her go.
633	Simple Future Tense	after this week he will let her go.
634	Future Continuous Tense	tomorrow at 1 pm he will be letting her go.
635	Future Perfect Tense	after this evening he will have let her go.
636	Future Perfect Continuous Tense	by the end of this year, he will have been letting her go.
637	Simple Present Tense	this day he takes her out.
638	Present Continuous Tense	today he is taking her out.
639	Present Perfect Tense	this day he has taken her out.
640	Present Perfect Continuous Tense	today he has been taking her out.
641	Simple Past Tense	before 1 pm he took her out.
642	Past Continuous Tense	since last winter he was taking her out.
643	Past Perfect Tense	after last morning he had taken her out.
644	Past Perfect Continuous Tense	yesterday at breakfast he had been taking her out.
645	Simple Future Tense	after this day he will take her out.
646	Future Continuous Tense	after this morning he will be taking her out.
647	Future Perfect Tense	next lunch he will have taken her out.
648	Future Perfect Continuous Tense	by next week he will have been taking her out.
649	Simple Present Tense	today he likes her.
650	Present Continuous Tense	at the moment he is liking her.
651	Present Perfect Tense	this day he has liked her.
652	Present Perfect Continuous Tense	this day he has been liking her.
653	Simple Past Tense	last week he liked her.
654	Past Continuous Tense	since last spring he was liking her.
655	Past Perfect Tense	after 1 pm he had liked her.
656	Past Perfect Continuous Tense	earlier he had been liking her.
657	Simple Future Tense	next morning he will like her.
658	Future Continuous Tense	after this autumn he will be liking her.
659	Future Perfect Tense	after this night he will have liked her.
660	Future Perfect Continuous Tense	by the end of this year, he will have been liking her.
661	Simple Present Tense	this day she gives him a dollar.
662	Present Continuous Tense	at the moment she is giving him a dollar.
663	Present Perfect Tense	this day she has given him a dollar.
664	Present Perfect Continuous Tense	today she has been giving him a dollar.
665	Simple Past Tense	lately she gave him a dollar.
666	Past Continuous Tense	since last year she was giving him a dollar.
667	Past Perfect Tense	before 9 am she had given him a dollar.
668	Past Perfect Continuous Tense	since 9 am she had been giving him a dollar.
669	Simple Future Tense	tomorrow morning she will give him a dollar.
670	Future Continuous Tense	tomorrow she will be giving him a dollar.
671	Future Perfect Tense	later this day she will have given him a dollar.
672	Future Perfect Continuous Tense	by the end of this year, she will have been giving him a dollar.
673	Simple Present Tense	today he believes it.
674	Present Continuous Tense	now he is believing it.
675	Present Perfect Tense	this day he has believed it.
676	Present Perfect Continuous Tense	today he has been believing it.
677	Simple Past Tense	last autumn he believed it.
678	Past Continuous Tense	since 12 o'clock he was believing it.
679	Past Perfect Tense	last saturday he had believed it.
680	Past Perfect Continuous Tense	since wednesday he had been believing it.
681	Simple Future Tense	later this night he will believe it.
682	Future Continuous Tense	next autumn he will be believing it.
683	Future Perfect Tense	later today he will have believed it.
684	Future Perfect Continuous Tense	by next week he will have been believing it.
685	Simple Present Tense	today she seems nice.
686	Present Continuous Tense	today she is seeming nice.
687	Present Perfect Tense	this day she has seemed nice.
688	Present Perfect Continuous Tense	this day she has been seeming nice.
689	Simple Past Tense	before last week she seemed nice.
690	Past Continuous Tense	since tuesday she was seeming nice.
691	Past Perfect Tense	last monday she had seemed nice.
692	Past Perfect Continuous Tense	last tuesday she had been seeming nice.
693	Simple Future Tense	next spring she will seem nice.
694	Future Continuous Tense	after this summer she will be seeming nice.
695	Future Perfect Tense	after this day she will have seemed nice.
696	Future Perfect Continuous Tense	in a few weeks she will have been seeming nice.
697	Simple Present Tense	this day she runs.
698	Present Continuous Tense	this day she is running.
699	Present Perfect Tense	this day she has run.
700	Present Perfect Continuous Tense	this day she has been running.
701	Simple Past Tense	after last summer she ran.
702	Past Continuous Tense	last autumn she was running.
703	Past Perfect Tense	after 1 pm she had run.
704	Past Perfect Continuous Tense	since 9 am she had been running.
705	Simple Future Tense	after this evening she will run.
706	Future Continuous Tense	next spring she will be running.
707	Future Perfect Tense	after this spring she will have run.
708	Future Perfect Continuous Tense	in a few weeks she will have been running.
709	Simple Present Tense	today she looks nice.
710	Present Continuous Tense	today she is looking nice.
711	Present Perfect Tense	this day she has looked nice.
712	Present Perfect Continuous Tense	today she has been looking nice.
713	Simple Past Tense	last year she looked nice.
714	Past Continuous Tense	since 12 o'clock she was looking nice.
715	Past Perfect Tense	earlier this night she had looked nice.
716	Past Perfect Continuous Tense	since tuesday she had been looking nice.
717	Simple Future Tense	after breakfast she will look nice.
718	Future Continuous Tense	next year she will be looking nice.
719	Future Perfect Tense	next breakfast she will have looked nice.
720	Future Perfect Continuous Tense	by the end of this year, she will have been looking nice.
721	Simple Present Tense	this day she walks.
722	Present Continuous Tense	now she is walking.
723	Present Perfect Tense	today she has walked.
724	Present Perfect Continuous Tense	this day she has been walking.
725	Simple Past Tense	after this evening she walked.
726	Past Continuous Tense	since last autumn she was walking.
727	Past Perfect Tense	before friday she had walked.
728	Past Perfect Continuous Tense	since this weekend she had been walking.
729	Simple Future Tense	after this weekend she will walk.
730	Future Continuous Tense	next dinner she will be walking.
731	Future Perfect Tense	tomorrow at 7 am she will have walked.
732	Future Perfect Continuous Tense	in a few weeks she will have been walking.
733	Simple Present Tense	this day it starts.
734	Present Continuous Tense	now it is starting.
735	Present Perfect Tense	today it has started.
736	Present Perfect Continuous Tense	today it has been starting.
737	Simple Past Tense	last year it started.
738	Past Continuous Tense	last friday it was starting.
739	Past Perfect Tense	before monday it had started.
740	Past Perfect Continuous Tense	after today it had been starting.
741	Simple Future Tense	after this week it will start.
742	Future Continuous Tense	next year it will be starting.
743	Future Perfect Tense	soon it will have started.
744	Future Perfect Continuous Tense	by tomorrow it will have been starting.
745	Simple Present Tense	today he helps.
746	Present Continuous Tense	at the moment he is helping.
747	Present Perfect Tense	this day he has helped.
748	Present Perfect Continuous Tense	today he has been helping.
749	Simple Past Tense	after this night he helped.
750	Past Continuous Tense	after this spring he was helping.
751	Past Perfect Tense	after today he had helped.
752	Past Perfect Continuous Tense	since last autumn he had been helping.
753	Simple Future Tense	later today he will help.
754	Future Continuous Tense	after this week he will be helping.
755	Future Perfect Tense	soon he will have helped.
756	Future Perfect Continuous Tense	before the end of summer, he will have been helping.
757	Simple Present Tense	today he moves.
758	Present Continuous Tense	now he is moving.
759	Present Perfect Tense	this day he has moved.
760	Present Perfect Continuous Tense	today he has been moving.
761	Simple Past Tense	recently he moved.
762	Past Continuous Tense	after last summer he was moving.
763	Past Perfect Tense	yesterday evening he had moved.
764	Past Perfect Continuous Tense	last monday he had been moving.
765	Simple Future Tense	next summer he will move.
766	Future Continuous Tense	later this morning he will be moving.
767	Future Perfect Tense	next dinner he will have moved.
768	Future Perfect Continuous Tense	by tomorrow he will have been moving.
769	Simple Present Tense	this day he turns around.
770	Present Continuous Tense	today he is turning around.
771	Present Perfect Tense	today he has turned around.
772	Present Perfect Continuous Tense	today he has been turning around.
773	Simple Past Tense	earlier he turned around.
774	Past Continuous Tense	yesterday evening he was turning around.
775	Past Perfect Tense	after lunch he had turned around.
776	Past Perfect Continuous Tense	since last autumn he had been turning around.
777	Simple Future Tense	after lunch he will turn around.
778	Future Continuous Tense	next week he will be turning around.
779	Future Perfect Tense	tomorrow at 1 pm he will have turned around.
780	Future Perfect Continuous Tense	by the end of this year, he will have been turning around.
781	Simple Present Tense	today it happens.
782	Present Continuous Tense	now it is happening.
783	Present Perfect Tense	this day it has happened.
784	Present Perfect Continuous Tense	today it has been happening.
785	Simple Past Tense	last sunday it happened.
786	Past Continuous Tense	since tuesday it was happening.
787	Past Perfect Tense	after last week it had happened.
788	Past Perfect Continuous Tense	last thursday it had been happening.
789	Simple Future Tense	next week it will happen.
790	Future Continuous Tense	next morning it will be happening.
791	Future Perfect Tense	tomorrrow evening it will have happened.
792	Future Perfect Continuous Tense	by next week it will have been happening.
793	Simple Present Tense	this day he arrives.
794	Present Continuous Tense	now he is arriving.
795	Present Perfect Tense	today he has arrived.
796	Present Perfect Continuous Tense	this day he has been arriving.
797	Simple Past Tense	recently he arrived.
798	Past Continuous Tense	since last summer he was arriving.
799	Past Perfect Tense	earlier this morning he had arrived.
800	Past Perfect Continuous Tense	since last spring he had been arriving.
801	Simple Future Tense	later this morning he will arrive.
802	Future Continuous Tense	after this spring he will be arriving.
803	Future Perfect Tense	after this autumn he will have arrived.
804	Future Perfect Continuous Tense	by tomorrow he will have been arriving.
